{
  "$schema": "../schemas/background.schema.json",
  "id": "soldier",
  "name": "Soldier",
  "description": "You served in a lord's levy or mercenary company. Discipline and violence are familiar companions. You left the ranks — by choice or circumstance.",
  "attribute_bonuses": {
    "strength": 2,
    "endurance": 1,
    "agility": 1,
    "charisma": -1
  },
  "starting_traits": ["cautious"],
  "starting_skills": {
    "sword_fighting": 2,
    "spear_fighting": 1,
    "survival": 2
  },
  "narrative_tags": ["combat", "military", "dangerous_start"]
}
